Cause du déplacement,Date,Population qui fuit,Destination,Nombre de personnes
Début des hostilités en Belgique,Premiers trois mois après le déclenchement de la guerre (1914),Réfugiés belges,Hollande,400'000 environ
Invasions et occupations par les forces allemandes,Après l'invasion allemande (date non spécifiée),Réfugiés belges,France,200'000 environ
Conséquences prolongées des hostilités en Belgique,Fin de l'année 1916,Réfugiés belges,Royaume-Uni,160'000 enregistrés
Invasions allemandes et menaces pour la sécurité locale,Fin août 1914,Réfugiés français internes,France,150'000 estimés
Continuation des hostilités en France et instabilité dans les régions frontalières,1er janvier 1915,Réfugiés français internes,France,Plus de 500'000
Avances stratégiques allemandes vers Amiens et Champagne,1918 (durant l'avancée allemande),Réfugiés français et belges,Zones intérieures de France,1.32 million en février ; 1.82 million en juillet (hausse de 500'000 en cinq mois)
Continuation des avancées militaires et instabilité continue,Septembre 1918,Tous les réfugiés,France,1.85 million