Cause du déplacement,Date,Population qui fuit,Destination,Nombre de personnes
Fuite des Juifs à cause de la guerre,Galicie et Bucovine (premier an de combats),Réfugiés juifs,Vienne et parties de Bohême et Moravie,Around 200'000 (ce chiffre ne comprend pas ceux qui ont été réinstallés dans la région ou envoyés au cœur du territoire russe)
Fuite des Italiens à cause de la guerre entre l'Empire Habsbourg et l'Italie,Période initiale de la guerre,Réfugiés italiens d'extraction,Italie,Around 40'00
Défaite d'Italie à Caporetto (Novembre 1917),Suite à la défaite des forces italiennes à Caporetto,Résidents du nord de l'Italie,Sud de l'Italie,Around 400'000
Fuite des Serbes suite à l'agression par les Habsbourg et l'Außenministerium,Années de la Première Guerre mondiale,Civiles serbes,Villes croissantes en Serbie,Nombre non spécifié (augmentation du facteur 10 ou plus)
Fuite des Serbes après la capture d'une grande partie du pays par les forces austro-bulgares et germaniques,Début de l'année suivante,Résidents de Macédoine grecs,Sud de la Macédoine,Around 500'000
Massacre des civils serbes suite à l'invasion bulgare en 1916,Années de la Première Guerre mondiale,Civils serbes,Sud de la Serbie,Around 2/3 du tiers de la population pré-guerre